<?xml version="1.0" encoding="UTF-8"?>
<products xmlns:xsi="http://www.w3.org/2001/XMLSchema-instance" xsi:noNamespaceSchemaLocation="productsSchema.xsd"><product id="id1"><category>Meat</category><name>Chicken</name><price>1</price><quantity>1</quantity><size>medium</size><photo>Uploads/potato.jpg</photo></product><product id="id2"><category>Vegetable</category><name>Carrot</name><price>1</price><quantity>1</quantity><size>small</size><photo>Uploads/potato.jpg</photo></product><product id="id3"><category>Fruit</category><name>Apple</name><price>1</price><quantity>1</quantity><size>small</size><photo>Uploads/potato.jpg</photo></product><product id="id4"><category>Fish</category><name>Hake</name><price>1</price><quantity>1</quantity><size>medium</size><photo>Uploads/potato.jpg</photo></product><product id="id5"><category>Carbohydrates</category><name>Bread</name><price>1</price><quantity>1</quantity><size>small</size><photo>Uploads/potato.jpg</photo></product></products>
